Marca temporal,Puntuación,What is your age group? (Optional),What is your current level of education? (Optional),Do you usually start lab work before the class ends at 12:30?,Do you only work on labs during the scheduled lab hours (12:30–16:30)?,How much extra time (outside lab hours) do you spend on labs per week?,When do you usually work on labs outside scheduled hours?,Do you take a lunch break between class and lab?,"If yes, how long is your typical lunch break?",Do you feel you need more time than the lab hours to complete your tasks?,Do you start working on labs even before the topic is fully covered in class?,What would help you use your lab time more efficiently? (Optional)
22/5/2025 13:50:43,,45+,Graduate student,No,No,5–7 hours,Evenings,"Yes, always.",15–30 minutes,Yes,No,
22/5/2025 13:51:46,,30–34,Undergraduate student,Sometimes,Yes,2–4 hours,"Evenings, Late at night, Weekends",Depends on the day,15–30 minutes,Yes,Sometimes,"It would be helpful if the lab material aligned more closely with the topics covered in class. That way, the time could be used to apply what we just learned, instead of trying to figure out new concepts on our own."
22/5/2025 14:21:04,,35–39,Graduate student,No,No,2–4 hours,"Late at night, Weekends","Yes, always.",30–60 minutes,Yes,No, A better understanding of the topic
22/5/2025 14:51:31,,40–44,Graduate student,No,No,5–7 hours,Evenings,"Yes, always.",30–60 minutes,Yes,I wait until everything is explained,If class was taught well and everything corresponds on the lab with the class. So I can only concentrate on the lab and not searching extra
22/5/2025 15:53:53,,30–34,Graduate student,Yes,Yes,Less than 2 hours,Before class in the morning,"Yes, always.",30–60 minutes,No,Yes,